{
  "$schema": "https://json-schema.org/draft/2020-12/schema",
  "$id": "urn:nubu2600:schema:level:2",
  "title": "NuBu2600 level",
  "description": "Формат одной полной карты одной сложности. Версия 1 сохраняет прямоугольные legacy-карты; версия 2 описывает поле как связное объединение панелей 20×20. Easy, medium и hard хранятся отдельными level payload, а не patches.",
  "type": "object",
  "additionalProperties": false,
  "required": [
    "kind",
    "schemaVersion",
    "id",
    "title",
    "episode",
    "sequence",
    "role",
    "size",
    "objects"
  ],
  "properties": {
    "kind": { "const": "nubu.level" },
    "schemaVersion": { "enum": [1, 2] },
    "id": {
      "type": "string",
      "minLength": 1,
      "pattern": "^[A-Za-z0-9][A-Za-z0-9._-]*$"
    },
    "title": { "type": "string", "minLength": 1 },
    "episode": { "type": "integer", "minimum": 1, "maximum": 99 },
    "sequence": { "type": "integer", "minimum": 1, "maximum": 999 },
    "role": {
      "enum": [
        "intro",
        "develop",
        "exam",
        "shop",
        "boss",
        "postboss",
        "secret",
        "training",
        "lobby"
      ]
    },
    "size": {
      "type": "object",
      "additionalProperties": false,
      "required": ["width", "height"],
      "properties": {
        "width": { "type": "integer", "minimum": 10, "maximum": 100 },
        "height": { "type": "integer", "minimum": 10, "maximum": 100 }
      }
    },
    "panels": {
      "type": "array",
      "minItems": 1,
      "maxItems": 8,
      "uniqueItems": true,
      "items": {
        "type": "object",
        "additionalProperties": false,
        "required": ["x", "y"],
        "properties": {
          "x": { "type": "integer", "minimum": 0, "maximum": 3 },
          "y": { "type": "integer", "minimum": 0, "maximum": 3 }
        }
      }
    },
    "theme": { "type": "string" },
    "learningGoal": { "type": "string" },
    "designerNotes": { "type": "string" },
    "parTimeSeconds": { "type": "number", "exclusiveMinimum": 0 },
    "objects": {
      "type": "array",
      "items": { "$ref": "#/$defs/levelObject" }
    },
    "metadata": {
      "type": "object",
      "additionalProperties": true,
      "properties": {
        "status": { "enum": ["idea", "graybox", "playable", "tuning", "locked", "released"] },
        "revision": { "type": "integer", "minimum": 1 },
        "source": { "type": "string" },
        "author": { "type": "string" },
        "difficulty": { "enum": ["easy", "medium", "hard"] }
      }
    }
  },
  "allOf": [
    {
      "if": {
        "properties": { "schemaVersion": { "const": 1 } },
        "required": ["schemaVersion"]
      },
      "then": {
        "not": { "required": ["panels"] }
      }
    },
    {
      "if": {
        "properties": { "schemaVersion": { "const": 2 } },
        "required": ["schemaVersion"]
      },
      "then": {
        "required": ["panels"],
        "properties": {
          "size": {
            "type": "object",
            "additionalProperties": false,
            "required": ["width", "height"],
            "properties": {
              "width": { "type": "integer", "minimum": 20, "maximum": 80, "multipleOf": 20 },
              "height": { "type": "integer", "minimum": 20, "maximum": 80, "multipleOf": 20 }
            }
          }
        }
      }
    }
  ],
  "$defs": {
    "halfCell": {
      "type": "number",
      "multipleOf": 0.5
    },
    "positiveHalfCell": {
      "type": "number",
      "exclusiveMinimum": 0,
      "multipleOf": 0.5
    },
    "objectType": {
      "enum": [
        "solid",
        "oneWay",
        "fragilePlatform",
        "blinkPlatform",
        "movingPlatform",
        "smartPlatform",
        "fallingPlatform",
        "conveyor",
        "bouncePad",
        "spike",
        "crusherWall",
        "door",
        "button",
        "portal",
        "driftField",
        "playerCannon",
        "flyerSpawner",
        "shooterSpawner",
        "bomberSpawner",
        "cannon",
        "boss",
        "enemyGoomba",
        "enemyFlyer",
        "enemyLeech",
        "enemySpikeCube",
        "pushBlock",
        "coin",
        "collectible",
        "pickup",
        "unlockSwitch",
        "heartVendor",
        "spawn",
        "exit",
        "secretExit",
        "label",
        "developerNote"
      ]
    },
    "levelObject": {
      "type": "object",
      "additionalProperties": false,
      "required": ["id", "type", "x", "y", "w", "h", "layer", "props"],
      "properties": {
        "id": {
          "type": "string",
          "minLength": 1,
          "pattern": "^[A-Za-z0-9][A-Za-z0-9._-]*$"
        },
        "type": { "$ref": "#/$defs/objectType" },
        "x": { "$ref": "#/$defs/halfCell" },
        "y": { "$ref": "#/$defs/halfCell" },
        "w": { "$ref": "#/$defs/positiveHalfCell" },
        "h": { "$ref": "#/$defs/positiveHalfCell" },
        "layer": { "enum": ["terrain", "gameplay", "hazard", "entity", "meta", "decor"] },
        "props": { "type": "object", "additionalProperties": true },
        "notes": { "type": "string" }
      },
      "allOf": [
        {
          "if": { "properties": { "type": { "const": "boss" } }, "required": ["type"] },
          "then": {
            "allOf": [
              {"if":{"properties":{"props":{"properties":{"bossKind":{"const":"ratSpider"}}}}},"then":{"properties":{"w":{"const":4},"h":{"const":4}}}},
              {"if":{"properties":{"props":{"properties":{"bossKind":{"const":"drone"}}}}},"then":{"properties":{"w":{"const":3},"h":{"const":3}}}},
              {"if":{"properties":{"props":{"properties":{"bossKind":{"const":"turret"}}}}},"then":{"properties":{"w":{"const":5},"h":{"const":5}}}}
            ],
            "properties": {
              "x": { "type": "integer", "minimum": 0 },
              "y": { "type": "integer", "minimum": 0 },
              "w": { "enum": [3,4,5] },
              "h": { "enum": [3,4,5] },
              "props": {
                "required": ["bossKind", "targets"],
                "properties": {
                  "bossKind": { "enum": ["ratSpider","drone","turret"] },
                  "targets": { "type": "array", "uniqueItems": true, "items": { "type": "string" } },
                  "controls": {
                    "type": "array", "minItems": 2, "maxItems": 2,
                    "items": {
                      "type": "object", "additionalProperties": false,
                      "required": ["x", "y", "w", "h"],
                      "oneOf": [
                        {"properties":{"w":{"const":3},"h":{"const":1},"side":{"enum":["up","down"]}}},
                        {"properties":{"w":{"const":1},"h":{"const":3},"side":{"enum":["left","right"]}}}
                      ],
                      "properties": {
                        "x": { "type": "integer", "minimum": 0 },
                        "y": { "type": "integer", "minimum": 0 },
                        "w": { "enum": [1,3] },
                        "h": { "enum": [1,3] },
                        "side": { "enum": ["up","right","down","left"] }
                      }
                    }
                  }
                }
              }
            }
          }
        },
        {
          "if": {
            "properties": { "type": { "const": "spawn" } },
            "required": ["type"]
          },
          "then": {
            "properties": {
              "w": { "const": 3 },
              "h": { "const": 3 },
              "props": {
                "type": "object",
                "required": ["semantics"],
                "properties": {
                  "semantics": { "const": "playerBody" }
                }
              }
            }
          }
        },
        {
          "if": {
            "properties": { "type": { "enum": ["exit", "secretExit"] } },
            "required": ["type"]
          },
          "then": {
            "properties": {
              "w": { "const": 3 },
              "h": { "const": 3 }
            }
          }
        },
        {
          "if": {
            "properties": { "type": { "const": "solid" } },
            "required": ["type"]
          },
          "then": {
            "properties": {
              "x": { "type": "integer" },
              "y": { "type": "integer" },
              "w": { "type": "integer", "minimum": 1 },
              "h": { "type": "integer", "minimum": 1 }
            }
          }
        }
      ]
    }
  }
}
