{
  "kind": "nubu.level",
  "schemaVersion": 2,
  "id": "lobby-03-easy",
  "title": "Лобби · Комната 03",
  "episode": 1,
  "sequence": 3,
  "role": "lobby",
  "size": {
    "width": 20,
    "height": 20
  },
  "theme": "lobby",
  "learningGoal": "Заготовка комнаты лобби для авторской сборки.",
  "designerNotes": "Пустая безопасная основа. Форма, предметы и маршруты будут нарисованы автором. Это ещё не готовый уровень.",
  "objects": [
    {
      "id": "floor",
      "type": "solid",
      "x": 0,
      "y": 18,
      "w": 20,
      "h": 2,
      "layer": "terrain",
      "props": {}
    },
    {
      "id": "spawn",
      "type": "spawn",
      "x": 16,
      "y": 15,
      "w": 3,
      "h": 3,
      "layer": "meta",
      "props": {
        "anchor": "centerTop",
        "semantics": "playerBody"
      }
    },
    {
      "id": "exit",
      "type": "exit",
      "x": 1,
      "y": 15,
      "w": 3,
      "h": 3,
      "layer": "meta",
      "props": {
        "route": "main"
      }
    }
  ],
  "metadata": {
    "status": "idea",
    "revision": 1,
    "source": "authoring-section-seed",
    "difficulty": "easy",
    "librarySection": "lobby",
    "placeholder": true
  },
  "panels": [
    {
      "x": 0,
      "y": 0
    }
  ]
}
