{"kind":"nubu.level","schemaVersion":2,"id":"ep3-16-medium","title":"3-16 · Безопасная грань пресса · Эскиз","episode":3,"sequence":16,"role":"exam","size":{"width":60,"height":40},"theme":"Безопасная грань пресса","learningGoal":"Пресс сначала выглядит стеной, затем становится мостом через нижнюю угрозу.","designerNotes":"Эскиз для авторской переработки. Пресс сначала выглядит стеной, затем становится мостом через нижнюю угрозу. Вход и выход: (56,35) → (21,22). Сложность меняет ширину промежуточных опор, не таймеры. Полная проходимость не подтверждена.","objects":[{"id":"solid-001","type":"solid","x":0,"y":38,"w":20,"h":2,"layer":"terrain","props":{}},{"id":"solid-002","type":"solid","x":20,"y":38,"w":20,"h":2,"layer":"terrain","props":{}},{"id":"solid-003","type":"solid","x":40,"y":38,"w":20,"h":2,"layer":"terrain","props":{}},{"id":"spawn-004","type":"spawn","x":56,"y":35,"w":3,"h":3,"layer":"meta","props":{"anchor":"centerTop","semantics":"playerBody"}},{"id":"exit-005","type":"exit","x":21,"y":22,"w":3,"h":3,"layer":"meta","props":{"route":"main"}},{"id":"oneWay-006","type":"oneWay","x":21,"y":25,"w":3,"h":1,"layer":"terrain","props":{}},{"id":"crusherWall-007","type":"crusherWall","x":9,"y":12,"w":3,"h":3,"layer":"hazard","props":{"path":[{"x":9,"y":12},{"x":9,"y":4}],"speedCellsPerSecond":2.4,"enabled":false,"loop":true,"spikes":false}},{"id":"button-008","type":"button","x":3,"y":17,"w":1,"h":1,"layer":"gameplay","props":{"buttonType":"T","sides":["up"],"targets":["crusherWall-007"]}},{"id":"oneWay-009","type":"oneWay","x":3,"y":18,"w":2,"h":1,"layer":"terrain","props":{}},{"id":"movingPlatform-010","type":"movingPlatform","x":5,"y":35,"w":4,"h":1,"layer":"gameplay","props":{"path":[{"x":5,"y":35},{"x":12,"y":25}],"speedCellsPerSecond":2.4,"enabled":true,"loop":true,"repeatSpacing":20,"moving":true}},{"id":"button-011","type":"button","x":3,"y":37,"w":1,"h":1,"layer":"gameplay","props":{"buttonType":"T","sides":["up"],"targets":["movingPlatform-010"]}},{"id":"crusherWall-012","type":"crusherWall","x":29,"y":32,"w":3,"h":3,"layer":"hazard","props":{"path":[{"x":29,"y":32},{"x":29,"y":24}],"speedCellsPerSecond":2.4,"enabled":false,"loop":true,"spikes":false}},{"id":"button-013","type":"button","x":23,"y":37,"w":1,"h":1,"layer":"gameplay","props":{"buttonType":"T","sides":["up"],"targets":["crusherWall-012"]}},{"id":"conveyor-014","type":"conveyor","x":45,"y":31,"w":7,"h":1,"layer":"gameplay","props":{"direction":"left","speed":"slow","mode":"always","enabled":true,"startActive":true}},{"id":"button-015","type":"button","x":43,"y":37,"w":1,"h":1,"layer":"gameplay","props":{"buttonType":"T","sides":["up"],"targets":["conveyor-014@reverse"]}},{"id":"oneWay-016","type":"oneWay","x":1,"y":9,"w":4,"h":1,"layer":"terrain","props":{}},{"id":"oneWay-017","type":"oneWay","x":14,"y":13,"w":4,"h":1,"layer":"terrain","props":{}},{"id":"oneWay-018","type":"oneWay","x":7,"y":17,"w":4,"h":1,"layer":"terrain","props":{}},{"id":"coin-019","type":"coin","x":5,"y":3,"w":1,"h":1,"layer":"gameplay","props":{}},{"id":"coin-020","type":"coin","x":13,"y":8,"w":1,"h":1,"layer":"gameplay","props":{}},{"id":"coin-021","type":"coin","x":9,"y":15,"w":1,"h":1,"layer":"gameplay","props":{}},{"id":"oneWay-022","type":"oneWay","x":1,"y":29,"w":4,"h":1,"layer":"terrain","props":{}},{"id":"oneWay-023","type":"oneWay","x":14,"y":33,"w":4,"h":1,"layer":"terrain","props":{}},{"id":"oneWay-024","type":"oneWay","x":7,"y":37,"w":4,"h":1,"layer":"terrain","props":{}},{"id":"coin-025","type":"coin","x":5,"y":23,"w":1,"h":1,"layer":"gameplay","props":{}},{"id":"coin-026","type":"coin","x":13,"y":28,"w":1,"h":1,"layer":"gameplay","props":{}},{"id":"coin-027","type":"coin","x":9,"y":35,"w":1,"h":1,"layer":"gameplay","props":{}},{"id":"oneWay-028","type":"oneWay","x":21,"y":29,"w":4,"h":1,"layer":"terrain","props":{}},{"id":"oneWay-029","type":"oneWay","x":34,"y":33,"w":4,"h":1,"layer":"terrain","props":{}},{"id":"oneWay-030","type":"oneWay","x":27,"y":37,"w":4,"h":1,"layer":"terrain","props":{}},{"id":"coin-031","type":"coin","x":25,"y":23,"w":1,"h":1,"layer":"gameplay","props":{}},{"id":"coin-032","type":"coin","x":33,"y":28,"w":1,"h":1,"layer":"gameplay","props":{}},{"id":"coin-033","type":"coin","x":29,"y":35,"w":1,"h":1,"layer":"gameplay","props":{}},{"id":"oneWay-034","type":"oneWay","x":41,"y":29,"w":4,"h":1,"layer":"terrain","props":{}},{"id":"oneWay-035","type":"oneWay","x":54,"y":33,"w":4,"h":1,"layer":"terrain","props":{}},{"id":"oneWay-036","type":"oneWay","x":47,"y":37,"w":4,"h":1,"layer":"terrain","props":{}},{"id":"coin-037","type":"coin","x":45,"y":23,"w":1,"h":1,"layer":"gameplay","props":{}},{"id":"coin-038","type":"coin","x":53,"y":28,"w":1,"h":1,"layer":"gameplay","props":{}},{"id":"coin-039","type":"coin","x":49,"y":35,"w":1,"h":1,"layer":"gameplay","props":{}},{"id":"developerNote-040","type":"developerNote","x":55,"y":35,"w":1,"h":1,"layer":"meta","props":{"comment":"Пресс сначала выглядит стеной, затем становится мостом через нижнюю угрозу. Эскиз, проходимость и баланс ещё не утверждены."}}],"metadata":{"status":"idea","revision":1,"source":"remaining-episodes-concepts-20260923","difficulty":"medium","template":true,"requiresCampaignIntegration":true,"motif":"press-ride"},"panels":[{"x":0,"y":0},{"x":0,"y":1},{"x":1,"y":1},{"x":2,"y":1}]}
