{"kind":"nubu.level","schemaVersion":2,"id":"ep5-07-hard","title":"5-7 · Поле и встречная лента · Эскиз","episode":5,"sequence":7,"role":"develop","size":{"width":20,"height":40},"theme":"Поле и встречная лента","learningGoal":"Набери высоту в поле, затем используй ленту для горизонтального выхода.","designerNotes":"Эскиз для авторской переработки. Набери высоту в поле, затем используй ленту для горизонтального выхода. Вход и выход: (1,15) → (16,22). Сложность меняет ширину промежуточных опор, не таймеры. Полная проходимость не подтверждена.","objects":[{"id":"solid-001","type":"solid","x":0,"y":38,"w":20,"h":2,"layer":"terrain","props":{}},{"id":"spawn-002","type":"spawn","x":1,"y":15,"w":3,"h":3,"layer":"meta","props":{"anchor":"centerTop","semantics":"playerBody"}},{"id":"oneWay-003","type":"oneWay","x":1,"y":18,"w":3,"h":1,"layer":"terrain","props":{}},{"id":"exit-004","type":"exit","x":16,"y":22,"w":3,"h":3,"layer":"meta","props":{"route":"main"}},{"id":"oneWay-005","type":"oneWay","x":16,"y":25,"w":3,"h":1,"layer":"terrain","props":{}},{"id":"driftField-006","type":"driftField","x":7,"y":4,"w":6,"h":13,"layer":"gameplay","props":{}},{"id":"oneWay-007","type":"oneWay","x":13,"y":6,"w":5,"h":1,"layer":"terrain","props":{}},{"id":"oneWay-008","type":"oneWay","x":2,"y":10,"w":5,"h":1,"layer":"terrain","props":{}},{"id":"conveyor-009","type":"conveyor","x":5,"y":34,"w":6,"h":1,"layer":"gameplay","props":{"direction":"right","speed":"fast","mode":"always"}},{"id":"button-010","type":"button","x":3,"y":37,"w":1,"h":1,"layer":"gameplay","props":{"buttonType":"T","sides":["up"],"targets":["conveyor-009"]}},{"id":"pickup-011","type":"pickup","x":5,"y":15,"w":3,"h":3,"layer":"gameplay","props":{"pickupType":"FL","abilityGroup":"gravity"}},{"id":"oneWay-012","type":"oneWay","x":1,"y":9,"w":3,"h":1,"layer":"terrain","props":{}},{"id":"oneWay-013","type":"oneWay","x":14,"y":13,"w":3,"h":1,"layer":"terrain","props":{}},{"id":"coin-014","type":"coin","x":5,"y":3,"w":1,"h":1,"layer":"gameplay","props":{}},{"id":"coin-015","type":"coin","x":13,"y":8,"w":1,"h":1,"layer":"gameplay","props":{}},{"id":"coin-016","type":"coin","x":9,"y":15,"w":1,"h":1,"layer":"gameplay","props":{}},{"id":"oneWay-017","type":"oneWay","x":1,"y":29,"w":3,"h":1,"layer":"terrain","props":{}},{"id":"oneWay-018","type":"oneWay","x":14,"y":33,"w":3,"h":1,"layer":"terrain","props":{}},{"id":"oneWay-019","type":"oneWay","x":7,"y":37,"w":3,"h":1,"layer":"terrain","props":{}},{"id":"coin-020","type":"coin","x":5,"y":23,"w":1,"h":1,"layer":"gameplay","props":{}},{"id":"coin-021","type":"coin","x":13,"y":28,"w":1,"h":1,"layer":"gameplay","props":{}},{"id":"coin-022","type":"coin","x":9,"y":35,"w":1,"h":1,"layer":"gameplay","props":{}},{"id":"developerNote-023","type":"developerNote","x":0,"y":15,"w":1,"h":1,"layer":"meta","props":{"comment":"Набери высоту в поле, затем используй ленту для горизонтального выхода. Эскиз, проходимость и баланс ещё не утверждены."}}],"metadata":{"status":"idea","revision":1,"source":"remaining-episodes-concepts-20260923","difficulty":"hard","template":true,"requiresCampaignIntegration":true,"motif":"field-belt"},"panels":[{"x":0,"y":0},{"x":0,"y":1}]}
