{"kind":"nubu.level","schemaVersion":2,"id":"ep4-09-easy","title":"4-9 · Два цвета, две задачи · Эскиз","episode":4,"sequence":9,"role":"intro","size":{"width":20,"height":40},"theme":"Два цвета, две задачи","learningGoal":"Одна пара поднимает, другая возвращает к центральному переключателю.","designerNotes":"Эскиз для авторской переработки. Одна пара поднимает, другая возвращает к центральному переключателю. Вход и выход: (1,2) → (16,35). Сложность меняет ширину промежуточных опор, не таймеры. Полная проходимость не подтверждена.","objects":[{"id":"solid-001","type":"solid","x":0,"y":38,"w":20,"h":2,"layer":"terrain","props":{}},{"id":"spawn-002","type":"spawn","x":1,"y":2,"w":3,"h":3,"layer":"meta","props":{"anchor":"centerTop","semantics":"playerBody"}},{"id":"oneWay-003","type":"oneWay","x":1,"y":5,"w":3,"h":1,"layer":"terrain","props":{}},{"id":"exit-004","type":"exit","x":16,"y":35,"w":3,"h":3,"layer":"meta","props":{"route":"main"}},{"id":"portal-005","type":"portal","x":4,"y":8,"w":2,"h":6,"layer":"gameplay","props":{"pairId":"P4-9-0-0","color":"purple","orientation":"vertical","side":"right","length":6}},{"id":"portal-006","type":"portal","x":14,"y":4,"w":2,"h":6,"layer":"gameplay","props":{"pairId":"P4-9-0-0","color":"purple","orientation":"vertical","side":"left","length":6}},{"id":"portal-007","type":"portal","x":4,"y":28,"w":2,"h":6,"layer":"gameplay","props":{"pairId":"P4-9-0-1","color":"purple","orientation":"vertical","side":"right","length":6}},{"id":"portal-008","type":"portal","x":14,"y":24,"w":2,"h":6,"layer":"gameplay","props":{"pairId":"P4-9-0-1","color":"purple","orientation":"vertical","side":"left","length":6}},{"id":"oneWay-009","type":"oneWay","x":14,"y":13,"w":4,"h":1,"layer":"terrain","props":{}},{"id":"oneWay-010","type":"oneWay","x":7,"y":17,"w":4,"h":1,"layer":"terrain","props":{}},{"id":"coin-011","type":"coin","x":5,"y":3,"w":1,"h":1,"layer":"gameplay","props":{}},{"id":"coin-012","type":"coin","x":13,"y":8,"w":1,"h":1,"layer":"gameplay","props":{}},{"id":"coin-013","type":"coin","x":9,"y":15,"w":1,"h":1,"layer":"gameplay","props":{}},{"id":"oneWay-014","type":"oneWay","x":14,"y":33,"w":4,"h":1,"layer":"terrain","props":{}},{"id":"oneWay-015","type":"oneWay","x":7,"y":37,"w":4,"h":1,"layer":"terrain","props":{}},{"id":"coin-016","type":"coin","x":5,"y":23,"w":1,"h":1,"layer":"gameplay","props":{}},{"id":"coin-017","type":"coin","x":13,"y":28,"w":1,"h":1,"layer":"gameplay","props":{}},{"id":"coin-018","type":"coin","x":9,"y":35,"w":1,"h":1,"layer":"gameplay","props":{}},{"id":"developerNote-019","type":"developerNote","x":0,"y":2,"w":1,"h":1,"layer":"meta","props":{"comment":"Одна пара поднимает, другая возвращает к центральному переключателю. Эскиз, проходимость и баланс ещё не утверждены."}}],"metadata":{"status":"idea","revision":1,"source":"remaining-episodes-concepts-20260923","difficulty":"easy","template":true,"requiresCampaignIntegration":true,"motif":"portal-pairs"},"panels":[{"x":0,"y":0},{"x":0,"y":1}]}
