{"kind":"nubu.level","schemaVersion":2,"id":"ep6-20-easy","title":"6-20 · Тяговый узел · Эскиз","episode":6,"sequence":20,"role":"exam","size":{"width":40,"height":20},"panels":[{"x":0,"y":0},{"x":1,"y":0}],"theme":"Тяговый узел","learningGoal":"Чередование движущейся опоры, перелёта и управления прессом.","designerNotes":"Эскиз для авторской переработки. Чередование движущейся опоры, перелёта и управления прессом. Вход и выход: (36,15) → (1,2). Сложность меняет ширину промежуточных опор, не таймеры. Полная проходимость не подтверждена.","objects":[{"id":"solid-001","type":"solid","x":0,"y":18,"w":20,"h":2,"layer":"terrain","props":{}},{"id":"solid-002","type":"solid","x":20,"y":18,"w":20,"h":2,"layer":"terrain","props":{}},{"id":"spawn-003","type":"spawn","x":36,"y":15,"w":3,"h":3,"layer":"meta","props":{"semantics":"playerBody","anchor":"centerTop"}},{"id":"exit-004","type":"exit","x":1,"y":2,"w":3,"h":3,"layer":"meta","props":{"route":"main"}},{"id":"oneWay-005","type":"oneWay","x":1,"y":5,"w":3,"h":1,"layer":"terrain","props":{}},{"id":"crusherWall-006","type":"crusherWall","x":9,"y":12,"w":3,"h":3,"layer":"hazard","props":{"path":[{"x":9,"y":12},{"x":9,"y":4}],"speedCellsPerSecond":2.4,"loop":true,"enabled":true,"spikes":false}},{"id":"button-007","type":"button","x":3,"y":17,"w":1,"h":1,"layer":"gameplay","props":{"buttonType":"T","sides":["up"],"targets":["crusherWall-006"]}},{"id":"crusherWall-008","type":"crusherWall","x":25,"y":12,"w":3,"h":3,"layer":"hazard","props":{"path":[{"x":25,"y":12},{"x":34,"y":12}],"speedCellsPerSecond":2.4,"loop":true,"enabled":false,"spikes":false}},{"id":"button-009","type":"button","x":23,"y":17,"w":1,"h":1,"layer":"gameplay","props":{"buttonType":"T","sides":["up"],"targets":["crusherWall-008"]}},{"id":"pickup-010","type":"pickup","x":32,"y":15,"w":3,"h":3,"layer":"gameplay","props":{"pickupType":"JP","abilityGroup":"gravity"}},{"id":"oneWay-011","type":"oneWay","x":1,"y":9,"w":4,"h":1,"layer":"terrain","props":{}},{"id":"oneWay-012","type":"oneWay","x":14,"y":13,"w":4,"h":1,"layer":"terrain","props":{}},{"id":"oneWay-013","type":"oneWay","x":7,"y":17,"w":4,"h":1,"layer":"terrain","props":{}},{"id":"coin-014","type":"coin","x":5,"y":3,"w":1,"h":1,"layer":"gameplay","props":{}},{"id":"coin-015","type":"coin","x":13,"y":8,"w":1,"h":1,"layer":"gameplay","props":{}},{"id":"coin-016","type":"coin","x":9,"y":15,"w":1,"h":1,"layer":"gameplay","props":{}},{"id":"oneWay-017","type":"oneWay","x":21,"y":9,"w":4,"h":1,"layer":"terrain","props":{}},{"id":"oneWay-018","type":"oneWay","x":34,"y":13,"w":4,"h":1,"layer":"terrain","props":{}},{"id":"oneWay-019","type":"oneWay","x":27,"y":17,"w":4,"h":1,"layer":"terrain","props":{}},{"id":"coin-020","type":"coin","x":25,"y":3,"w":1,"h":1,"layer":"gameplay","props":{}},{"id":"coin-021","type":"coin","x":33,"y":8,"w":1,"h":1,"layer":"gameplay","props":{}},{"id":"coin-022","type":"coin","x":29,"y":15,"w":1,"h":1,"layer":"gameplay","props":{}},{"id":"developerNote-023","type":"developerNote","x":35,"y":15,"w":1,"h":1,"layer":"meta","props":{"comment":"Чередование движущейся опоры, перелёта и управления прессом. Эскиз, проходимость и баланс ещё не утверждены."}}],"metadata":{"status":"idea","difficulty":"easy","revision":1,"source":"remaining-episodes-concepts-20260923","template":true,"requiresCampaignIntegration":true,"motif":"jet-press"}}
