{"kind":"nubu.level","schemaVersion":2,"id":"ep2-13-easy","title":"Э2 · С13 · Ход пресса","episode":2,"sequence":13,"role":"intro","size":{"width":20,"height":20},"theme":"service-shafts","learningGoal":"Практическая комната по плану EP2.","designerNotes":"Игровой черновик easy. Широкие опоры и спокойные циклы. WJ у входа нужен для отдельной проверки без прохождения EP1. Эскиз передаёт идею для авторской переработки. Точная проходимость не является целью этой версии; переходы EP2 и боссовый контроллер не подключены. ","objects":[{"id":"solid-1","type":"solid","x":0,"y":18,"w":20,"h":2,"layer":"terrain","props":{}},{"id":"spawn","type":"spawn","x":1,"y":15,"w":3,"h":3,"layer":"meta","props":{"anchor":"centerTop","semantics":"playerBody"}},{"id":"crusherWall-2","type":"crusherWall","x":5,"y":14,"w":3,"h":3,"layer":"hazard","props":{"path":[{"x":5,"y":14},{"x":15,"y":14}],"speedCellsPerSecond":1.5,"enabled":true,"loop":true,"spikes":false}},{"id":"oneWay-3","type":"oneWay","x":11,"y":10,"w":3,"h":1,"layer":"terrain","props":{}},{"id":"exit","type":"exit","x":16,"y":3,"w":3,"h":3,"layer":"meta","props":{"route":"main"}},{"id":"label-5","type":"label","x":1,"y":8,"w":6,"h":2,"layer":"decor","props":{"mode":"player","text":"Дождись свободного прохода","color":"#d8e2ff","decorative":true,"marquee":true}},{"id":"coin-6","type":"coin","x":11,"y":8,"w":1,"h":1,"layer":"gameplay","props":{}},{"id":"solid-01","type":"solid","x":15,"y":6,"w":5,"h":2,"layer":"terrain","props":{}},{"id":"coin-01","type":"coin","x":13,"y":8,"w":1,"h":1,"layer":"entity","props":{}},{"id":"coin-02","type":"coin","x":17,"y":12,"w":1,"h":1,"layer":"entity","props":{}},{"id":"coin-03","type":"coin","x":6,"y":12,"w":1,"h":1,"layer":"entity","props":{}},{"id":"coin-04","type":"coin","x":12,"y":6,"w":1,"h":1,"layer":"entity","props":{}},{"id":"solid-03","type":"solid","x":0,"y":0,"w":8,"h":8,"layer":"terrain","props":{}},{"id":"solid-04","type":"solid","x":0,"y":10,"w":8,"h":1,"layer":"terrain","props":{}},{"id":"solid-05","type":"solid","x":0,"y":8,"w":1,"h":2,"layer":"terrain","props":{}},{"id":"solid-06","type":"solid","x":7,"y":8,"w":1,"h":2,"layer":"terrain","props":{}},{"id":"solid-02","type":"solid","x":8,"y":0,"w":12,"h":1,"layer":"terrain","props":{}}],"metadata":{"status":"graybox","revision":2,"source":"ep2-authored-graybox-v1","difficulty":"easy","librarySection":"campaign-2","placeholder":false,"prerequisites":["WJ"],"requiresCampaignIntegration":true},"panels":[{"x":0,"y":0}]}
