{
  "kind": "nubu.level",
  "schemaVersion": 1,
  "id": "ep1-15-medium",
  "title": "С15 · Э1 · Средняя · 4-3 · Большой обход",
  "episode": 1,
  "sequence": 15,
  "role": "develop",
  "size": {
    "width": 20,
    "height": 20
  },
  "theme": "Большой обход",
  "learningGoal": "Graybox-предложение по последнему плану episode 1.pages; требует авторского плейтеста и правки.",
  "designerNotes": "Черновик Средняя из исходного слота 1-17; это не готовая авторская Easy-карта. Смерть возвращает к входу этой комнаты; чекпоинтов нет. Исходные описания сохранены в metadata.importSource.",
  "objects": [
    {
      "id": "solid-01",
      "type": "solid",
      "x": 0,
      "y": 18,
      "w": 20,
      "h": 2,
      "layer": "terrain",
      "props": {}
    },
    {
      "id": "solid-02",
      "type": "solid",
      "x": 3,
      "y": 11,
      "w": 5,
      "h": 1,
      "layer": "terrain",
      "props": {}
    },
    {
      "id": "solid-03",
      "type": "solid",
      "x": 12,
      "y": 11,
      "w": 5,
      "h": 1,
      "layer": "terrain",
      "props": {}
    },
    {
      "id": "spawn-01",
      "type": "spawn",
      "x": 1,
      "y": 15,
      "w": 3,
      "h": 3,
      "layer": "meta",
      "props": {
        "anchor": "centerTop",
        "semantics": "playerBody"
      }
    },
    {
      "id": "exit-main",
      "type": "exit",
      "x": 16,
      "y": 8,
      "w": 3,
      "h": 3,
      "layer": "meta",
      "props": {
        "route": "main"
      }
    },
    {
      "id": "door-01",
      "type": "door",
      "x": 8,
      "y": 15,
      "w": 1,
      "h": 3,
      "layer": "gameplay",
      "props": {
        "orientation": "vertical",
        "open": false
      }
    },
    {
      "id": "door-02",
      "type": "door",
      "x": 11,
      "y": 8,
      "w": 1,
      "h": 3,
      "layer": "gameplay",
      "props": {
        "orientation": "vertical",
        "open": false
      }
    },
    {
      "id": "button-01",
      "type": "button",
      "x": 5,
      "y": 10,
      "w": 1,
      "h": 1,
      "layer": "gameplay",
      "props": {
        "buttonType": "T",
        "sides": [
          "up"
        ],
        "targets": [
          "door-01"
        ]
      }
    },
    {
      "id": "button-02",
      "type": "button",
      "x": 14,
      "y": 10,
      "w": 1,
      "h": 1,
      "layer": "gameplay",
      "props": {
        "buttonType": "T",
        "sides": [
          "up"
        ],
        "targets": [
          "door-02"
        ]
      }
    },
    {
      "id": "oneWay-01",
      "type": "oneWay",
      "x": 8,
      "y": 6,
      "w": 4,
      "h": 1,
      "layer": "terrain",
      "props": {}
    }
  ],
  "metadata": {
    "status": "idea",
    "revision": 1,
    "source": "episode 1.pages graybox proposal",
    "difficulty": "medium",
    "template": true,
    "campaign": {
      "layoutVersion": 2,
      "slot": 15,
      "kind": "normal",
      "bundle": 4,
      "levelInBundle": 3,
      "normalNumber": 15,
      "name": "Большой обход",
      "sourceSlot": 17,
      "authored": false,
      "deathRestart": "roomStart"
    },
    "importSource": {
      "file": "nubu2600-library-2026-09-03.json",
      "sha256": "7de0dc488af45f31bb57fc8869ac4500260ef29c11feb29b1c76b6083c06f6b1",
      "exportedAt": 1788403891679,
      "sourceSlot": 17,
      "originalId": "ep1-17-medium",
      "originalTitle": "Эпизод 1 · Средняя · Уровень 1-17 · Выбор двери",
      "originalRole": "intro",
      "originalTheme": "Две кнопки и две двери: главный маршрут против бонусного.",
      "originalLearningGoal": "Graybox-предложение по последнему плану episode 1.pages; требует авторского плейтеста и правки.",
      "originalDesignerNotes": "Шаблон N17: Две кнопки и две двери: главный маршрут против бонусного. Можно очистить или заменить; это не утверждённый финальный уровень. Карта средняя сложности — отдельная полная копия для дальнейшей настройки."
    },
    "geometryMigrations": [
      {
        "id": "spawn-01",
        "before": {
          "id": "spawn-01",
          "type": "spawn",
          "x": 1,
          "y": 16,
          "w": 1,
          "h": 2,
          "layer": "meta",
          "props": {
            "anchor": "topLeft",
            "semantics": "playerBody"
          }
        },
        "after": {
          "id": "spawn-01",
          "type": "spawn",
          "x": 1,
          "y": 15,
          "w": 3,
          "h": 3,
          "layer": "meta",
          "props": {
            "anchor": "centerTop",
            "semantics": "playerBody"
          }
        }
      },
      {
        "id": "exit-main",
        "before": {
          "id": "exit-main",
          "type": "exit",
          "x": 16,
          "y": 8,
          "w": 2,
          "h": 3,
          "layer": "meta",
          "props": {
            "route": "main"
          }
        },
        "after": {
          "id": "exit-main",
          "type": "exit",
          "x": 16,
          "y": 8,
          "w": 3,
          "h": 3,
          "layer": "meta",
          "props": {
            "route": "main"
          }
        }
      }
    ]
  }
}
