{"kind":"nubu.level","schemaVersion":2,"id":"ep2-14-hard","title":"Э2 · С14 · Карманы над прессом","episode":2,"sequence":14,"role":"develop","size":{"width":40,"height":40},"theme":"service-shafts","learningGoal":"Практическая комната по плану EP2.","designerNotes":"Игровой черновик easy. Широкие опоры и спокойные циклы. WJ у входа нужен для отдельной проверки без прохождения EP1. Эскиз передаёт идею для авторской переработки. Точная проходимость не является целью этой версии; переходы EP2 и боссовый контроллер не подключены. ","objects":[{"id":"solid-1","type":"solid","x":0,"y":38,"w":20,"h":2,"layer":"terrain","props":{}},{"id":"solid-2","type":"solid","x":20,"y":38,"w":20,"h":2,"layer":"terrain","props":{}},{"id":"spawn","type":"spawn","x":13,"y":35,"w":3,"h":3,"layer":"meta","props":{"anchor":"centerTop","semantics":"playerBody"}},{"id":"crusherWall-5","type":"crusherWall","x":6,"y":33,"w":2,"h":5,"layer":"hazard","props":{"path":[{"x":6,"y":33},{"x":13,"y":33}],"speedCellsPerSecond":4,"enabled":true,"loop":true,"spikes":false}},{"id":"solid-8","type":"solid","x":34,"y":0,"w":6,"h":38,"layer":"terrain","props":{}},{"id":"exit","type":"exit","x":30,"y":1,"w":3,"h":3,"layer":"meta","props":{"route":"main"}},{"id":"crusher-wall-01","type":"crusherWall","x":22,"y":33,"w":2,"h":5,"layer":"hazard","props":{"path":[{"x":22,"y":33},{"x":15,"y":33}],"speedCellsPerSecond":4,"enabled":true,"loop":true,"spikes":false}},{"id":"solid-01","type":"solid","x":0,"y":20,"w":13,"h":4,"layer":"terrain","props":{}},{"id":"solid-08","type":"solid","x":0,"y":24,"w":10,"h":3,"layer":"terrain","props":{}},{"id":"solid-09","type":"solid","x":0,"y":27,"w":10,"h":3,"layer":"terrain","props":{}},{"id":"solid-03","type":"solid","x":20,"y":18,"w":5,"h":2,"layer":"terrain","props":{}},{"id":"crusher-wall-02","type":"crusherWall","x":20,"y":16,"w":5,"h":2,"layer":"hazard","props":{"path":[{"x":20,"y":16},{"x":20,"y":4}],"speedCellsPerSecond":4,"enabled":true,"loop":true,"spikes":false}},{"id":"solid-04","type":"solid","x":29,"y":4,"w":5,"h":8,"layer":"terrain","props":{}},{"id":"solid-05","type":"solid","x":0,"y":30,"w":3,"h":8,"layer":"terrain","props":{}},{"id":"solid-06","type":"solid","x":27,"y":26,"w":7,"h":12,"layer":"terrain","props":{}},{"id":"coin-01","type":"coin","x":19,"y":27,"w":1,"h":1,"layer":"entity","props":{}},{"id":"coin-02","type":"coin","x":15,"y":31,"w":1,"h":1,"layer":"entity","props":{}},{"id":"coin-03","type":"coin","x":15,"y":27,"w":1,"h":1,"layer":"entity","props":{}},{"id":"coin-04","type":"coin","x":22,"y":24,"w":1,"h":1,"layer":"entity","props":{}},{"id":"coin-05","type":"coin","x":30,"y":22,"w":1,"h":1,"layer":"entity","props":{}},{"id":"coin-06","type":"coin","x":26,"y":24,"w":1,"h":1,"layer":"entity","props":{}},{"id":"coin-07","type":"coin","x":30,"y":18,"w":1,"h":1,"layer":"entity","props":{}},{"id":"coin-08","type":"coin","x":32,"y":20,"w":1,"h":1,"layer":"entity","props":{}},{"id":"coin-09","type":"coin","x":32,"y":16,"w":1,"h":1,"layer":"entity","props":{}},{"id":"coin-10","type":"coin","x":23,"y":14,"w":1,"h":1,"layer":"entity","props":{}},{"id":"coin-11","type":"coin","x":21,"y":8,"w":1,"h":1,"layer":"entity","props":{}},{"id":"coin-12","type":"coin","x":21,"y":12,"w":1,"h":1,"layer":"entity","props":{}},{"id":"coin-13","type":"coin","x":23,"y":10,"w":1,"h":1,"layer":"entity","props":{}},{"id":"coin-14","type":"coin","x":28,"y":5,"w":1,"h":1,"layer":"entity","props":{}},{"id":"coin-15","type":"coin","x":14,"y":29,"w":1,"h":1,"layer":"entity","props":{}},{"id":"solid-07","type":"solid","x":20,"y":0,"w":5,"h":4,"layer":"terrain","props":{}},{"id":"solid-02","type":"solid","x":3,"y":30,"w":7,"h":2,"layer":"terrain","props":{}},{"id":"solid-12","type":"solid","x":3,"y":32,"w":3,"h":6,"layer":"terrain","props":{}},{"id":"solid-13","type":"solid","x":24,"y":26,"w":3,"h":12,"layer":"terrain","props":{}},{"id":"solid-10","type":"solid","x":20,"y":26,"w":4,"h":6,"layer":"terrain","props":{}},{"id":"crusher-wall-03","type":"crusherWall","x":29,"y":24,"w":5,"h":2,"layer":"hazard","props":{"path":[{"x":29,"y":24},{"x":29,"y":12}],"speedCellsPerSecond":4,"enabled":true,"loop":true,"spikes":false}},{"id":"spike-01","type":"spike","x":10,"y":24,"w":1,"h":7,"layer":"hazard","props":{"direction":"right","mode":"always","cycle":2,"startActive":true}},{"id":"spike-02","type":"spike","x":13,"y":20,"w":11,"h":1,"layer":"hazard","props":{"direction":"down","mode":"always","cycle":2,"startActive":true}},{"id":"spike-03","type":"spike","x":13,"y":21,"w":1,"h":3,"layer":"hazard","props":{"direction":"right","mode":"always","cycle":2,"startActive":true}},{"id":"spike-04","type":"spike","x":11,"y":24,"w":2,"h":1,"layer":"hazard","props":{"direction":"down","mode":"always","cycle":2,"startActive":true}},{"id":"spike-05","type":"spike","x":33,"y":14,"w":1,"h":10,"layer":"hazard","props":{"direction":"left","mode":"always","cycle":2,"startActive":true}},{"id":"spike-06","type":"spike","x":20,"y":6,"w":1,"h":10,"layer":"hazard","props":{"direction":"right","mode":"always","cycle":2,"startActive":true}},{"id":"spike-07","type":"spike","x":6,"y":32,"w":3,"h":1,"layer":"hazard","props":{"direction":"down","mode":"always","cycle":2,"startActive":true}},{"id":"spike-08","type":"spike","x":21,"y":32,"w":3,"h":1,"layer":"hazard","props":{"direction":"down","mode":"always","cycle":2,"startActive":true}},{"id":"spike-09","type":"spike","x":25,"y":0,"w":1,"h":3,"layer":"hazard","props":{"direction":"right","mode":"always","cycle":2,"startActive":true}}],"metadata":{"status":"graybox","revision":2,"source":"ep2-authored-graybox-v1","difficulty":"hard","librarySection":"campaign-2","placeholder":false,"prerequisites":["WJ"],"requiresCampaignIntegration":true},"panels":[{"x":1,"y":0},{"x":0,"y":1},{"x":1,"y":1}]}
