{"kind":"nubu.level","schemaVersion":2,"id":"ep6-18-medium","title":"6-18 · Точность без спешки · Эскиз","episode":6,"sequence":18,"role":"develop","size":{"width":60,"height":40},"panels":[{"x":0,"y":0},{"x":0,"y":1},{"x":1,"y":1},{"x":2,"y":1}],"theme":"Точность без спешки","learningGoal":"Короткие посадки расположены чаще, но каждый такт можно начать заново.","designerNotes":"Эскиз для авторской переработки. Короткие посадки расположены чаще, но каждый такт можно начать заново. Вход и выход: (56,22) → (21,35). Сложность меняет ширину промежуточных опор, не таймеры. Полная проходимость не подтверждена.","objects":[{"id":"solid-001","type":"solid","x":0,"y":38,"w":20,"h":2,"layer":"terrain","props":{}},{"id":"solid-002","type":"solid","x":20,"y":38,"w":20,"h":2,"layer":"terrain","props":{}},{"id":"solid-003","type":"solid","x":40,"y":38,"w":20,"h":2,"layer":"terrain","props":{}},{"id":"spawn-004","type":"spawn","x":56,"y":22,"w":3,"h":3,"layer":"meta","props":{"semantics":"playerBody","anchor":"centerTop"}},{"id":"oneWay-005","type":"oneWay","x":56,"y":25,"w":3,"h":1,"layer":"terrain","props":{}},{"id":"exit-006","type":"exit","x":21,"y":35,"w":3,"h":3,"layer":"meta","props":{"route":"main"}},{"id":"oneWay-007","type":"oneWay","x":5,"y":14,"w":4,"h":1,"layer":"terrain","props":{}},{"id":"oneWay-008","type":"oneWay","x":11,"y":9,"w":4,"h":1,"layer":"terrain","props":{}},{"id":"oneWay-009","type":"oneWay","x":5,"y":4,"w":4,"h":1,"layer":"terrain","props":{}},{"id":"crusherWall-010","type":"crusherWall","x":5,"y":32,"w":3,"h":3,"layer":"hazard","props":{"path":[{"x":5,"y":32},{"x":14,"y":32}],"speedCellsPerSecond":2.4,"loop":true,"enabled":false,"spikes":false}},{"id":"button-011","type":"button","x":3,"y":37,"w":1,"h":1,"layer":"gameplay","props":{"buttonType":"T","sides":["up"],"targets":["crusherWall-010"]}},{"id":"crusherWall-012","type":"crusherWall","x":29,"y":32,"w":3,"h":3,"layer":"hazard","props":{"path":[{"x":29,"y":32},{"x":29,"y":24}],"speedCellsPerSecond":2.4,"loop":true,"enabled":true,"spikes":false}},{"id":"button-013","type":"button","x":36,"y":37,"w":1,"h":1,"layer":"gameplay","props":{"buttonType":"T","sides":["up"],"targets":["crusherWall-012"]}},{"id":"oneWay-014","type":"oneWay","x":45,"y":34,"w":4,"h":1,"layer":"terrain","props":{}},{"id":"oneWay-015","type":"oneWay","x":51,"y":29,"w":4,"h":1,"layer":"terrain","props":{}},{"id":"oneWay-016","type":"oneWay","x":45,"y":24,"w":4,"h":1,"layer":"terrain","props":{}},{"id":"pickup-017","type":"pickup","x":52,"y":22,"w":3,"h":3,"layer":"gameplay","props":{"pickupType":"JP","abilityGroup":"gravity"}},{"id":"oneWay-018","type":"oneWay","x":1,"y":9,"w":4,"h":1,"layer":"terrain","props":{}},{"id":"oneWay-019","type":"oneWay","x":14,"y":13,"w":4,"h":1,"layer":"terrain","props":{}},{"id":"oneWay-020","type":"oneWay","x":7,"y":17,"w":4,"h":1,"layer":"terrain","props":{}},{"id":"coin-021","type":"coin","x":5,"y":3,"w":1,"h":1,"layer":"gameplay","props":{}},{"id":"coin-022","type":"coin","x":13,"y":8,"w":1,"h":1,"layer":"gameplay","props":{}},{"id":"coin-023","type":"coin","x":9,"y":15,"w":1,"h":1,"layer":"gameplay","props":{}},{"id":"oneWay-024","type":"oneWay","x":1,"y":29,"w":4,"h":1,"layer":"terrain","props":{}},{"id":"oneWay-025","type":"oneWay","x":14,"y":33,"w":4,"h":1,"layer":"terrain","props":{}},{"id":"oneWay-026","type":"oneWay","x":7,"y":37,"w":4,"h":1,"layer":"terrain","props":{}},{"id":"coin-027","type":"coin","x":5,"y":23,"w":1,"h":1,"layer":"gameplay","props":{}},{"id":"coin-028","type":"coin","x":13,"y":28,"w":1,"h":1,"layer":"gameplay","props":{}},{"id":"coin-029","type":"coin","x":9,"y":35,"w":1,"h":1,"layer":"gameplay","props":{}},{"id":"oneWay-030","type":"oneWay","x":21,"y":29,"w":4,"h":1,"layer":"terrain","props":{}},{"id":"oneWay-031","type":"oneWay","x":34,"y":33,"w":4,"h":1,"layer":"terrain","props":{}},{"id":"oneWay-032","type":"oneWay","x":27,"y":37,"w":4,"h":1,"layer":"terrain","props":{}},{"id":"coin-033","type":"coin","x":25,"y":23,"w":1,"h":1,"layer":"gameplay","props":{}},{"id":"coin-034","type":"coin","x":33,"y":28,"w":1,"h":1,"layer":"gameplay","props":{}},{"id":"coin-035","type":"coin","x":29,"y":35,"w":1,"h":1,"layer":"gameplay","props":{}},{"id":"oneWay-036","type":"oneWay","x":41,"y":29,"w":4,"h":1,"layer":"terrain","props":{}},{"id":"oneWay-037","type":"oneWay","x":54,"y":33,"w":4,"h":1,"layer":"terrain","props":{}},{"id":"oneWay-038","type":"oneWay","x":47,"y":37,"w":4,"h":1,"layer":"terrain","props":{}},{"id":"coin-039","type":"coin","x":45,"y":23,"w":1,"h":1,"layer":"gameplay","props":{}},{"id":"coin-040","type":"coin","x":53,"y":28,"w":1,"h":1,"layer":"gameplay","props":{}},{"id":"coin-041","type":"coin","x":49,"y":35,"w":1,"h":1,"layer":"gameplay","props":{}},{"id":"developerNote-042","type":"developerNote","x":55,"y":22,"w":1,"h":1,"layer":"meta","props":{"comment":"Короткие посадки расположены чаще, но каждый такт можно начать заново. Эскиз, проходимость и баланс ещё не утверждены."}}],"metadata":{"status":"idea","difficulty":"medium","revision":1,"source":"remaining-episodes-concepts-20260923","template":true,"requiresCampaignIntegration":true,"motif":"jet-steps"}}
