{"kind":"nubu.level","schemaVersion":2,"id":"ep5-19-easy","title":"5-19 · Отключение помехи · Эскиз","episode":5,"sequence":19,"role":"develop","size":{"width":60,"height":20},"panels":[{"x":0,"y":0},{"x":1,"y":0},{"x":2,"y":0}],"theme":"Отключение помехи","learningGoal":"Выключи генератор снарядов до воздушного участка.","designerNotes":"Эскиз для авторской переработки. Выключи генератор снарядов до воздушного участка. Вход и выход: (1,15) → (56,2). Сложность меняет ширину промежуточных опор, не таймеры. Полная проходимость не подтверждена.","objects":[{"id":"solid-001","type":"solid","x":0,"y":18,"w":20,"h":2,"layer":"terrain","props":{}},{"id":"solid-002","type":"solid","x":20,"y":18,"w":20,"h":2,"layer":"terrain","props":{}},{"id":"solid-003","type":"solid","x":40,"y":18,"w":20,"h":2,"layer":"terrain","props":{}},{"id":"spawn-004","type":"spawn","x":1,"y":15,"w":3,"h":3,"layer":"meta","props":{"semantics":"playerBody","anchor":"centerTop"}},{"id":"exit-005","type":"exit","x":56,"y":2,"w":3,"h":3,"layer":"meta","props":{"route":"main"}},{"id":"oneWay-006","type":"oneWay","x":56,"y":5,"w":3,"h":1,"layer":"terrain","props":{}},{"id":"cannon-007","type":"cannon","x":6,"y":7,"w":2,"h":2,"layer":"gameplay","props":{"direction":"right","interval":2,"enabled":true,"projectileMode":"soft"}},{"id":"button-008","type":"button","x":16,"y":17,"w":1,"h":1,"layer":"gameplay","props":{"buttonType":"T","sides":["up"],"targets":["cannon-007"]}},{"id":"solid-009","type":"solid","x":12,"y":11,"w":2,"h":4,"layer":"terrain","props":{}},{"id":"crusherWall-010","type":"crusherWall","x":29,"y":12,"w":3,"h":3,"layer":"hazard","props":{"path":[{"x":29,"y":12},{"x":29,"y":4}],"speedCellsPerSecond":2.4,"loop":true,"enabled":true,"spikes":false}},{"id":"button-011","type":"button","x":23,"y":17,"w":1,"h":1,"layer":"gameplay","props":{"buttonType":"T","sides":["up"],"targets":["crusherWall-010"]}},{"id":"oneWay-012","type":"oneWay","x":45,"y":5,"w":5,"h":1,"layer":"terrain","props":{}},{"id":"oneWay-013","type":"oneWay","x":52,"y":10,"w":5,"h":1,"layer":"terrain","props":{}},{"id":"oneWay-014","type":"oneWay","x":46,"y":15,"w":5,"h":1,"layer":"terrain","props":{}},{"id":"pickup-015","type":"pickup","x":5,"y":15,"w":3,"h":3,"layer":"gameplay","props":{"pickupType":"FL","abilityGroup":"gravity"}},{"id":"oneWay-016","type":"oneWay","x":1,"y":9,"w":4,"h":1,"layer":"terrain","props":{}},{"id":"oneWay-017","type":"oneWay","x":14,"y":13,"w":4,"h":1,"layer":"terrain","props":{}},{"id":"coin-018","type":"coin","x":5,"y":3,"w":1,"h":1,"layer":"gameplay","props":{}},{"id":"coin-019","type":"coin","x":13,"y":8,"w":1,"h":1,"layer":"gameplay","props":{}},{"id":"coin-020","type":"coin","x":9,"y":15,"w":1,"h":1,"layer":"gameplay","props":{}},{"id":"oneWay-021","type":"oneWay","x":21,"y":9,"w":4,"h":1,"layer":"terrain","props":{}},{"id":"oneWay-022","type":"oneWay","x":34,"y":13,"w":4,"h":1,"layer":"terrain","props":{}},{"id":"oneWay-023","type":"oneWay","x":27,"y":17,"w":4,"h":1,"layer":"terrain","props":{}},{"id":"coin-024","type":"coin","x":25,"y":3,"w":1,"h":1,"layer":"gameplay","props":{}},{"id":"coin-025","type":"coin","x":33,"y":8,"w":1,"h":1,"layer":"gameplay","props":{}},{"id":"coin-026","type":"coin","x":29,"y":15,"w":1,"h":1,"layer":"gameplay","props":{}},{"id":"oneWay-027","type":"oneWay","x":41,"y":9,"w":4,"h":1,"layer":"terrain","props":{}},{"id":"oneWay-028","type":"oneWay","x":54,"y":13,"w":4,"h":1,"layer":"terrain","props":{}},{"id":"oneWay-029","type":"oneWay","x":47,"y":17,"w":4,"h":1,"layer":"terrain","props":{}},{"id":"coin-030","type":"coin","x":45,"y":3,"w":1,"h":1,"layer":"gameplay","props":{}},{"id":"coin-031","type":"coin","x":53,"y":8,"w":1,"h":1,"layer":"gameplay","props":{}},{"id":"developerNote-032","type":"developerNote","x":0,"y":15,"w":1,"h":1,"layer":"meta","props":{"comment":"Выключи генератор снарядов до воздушного участка. Эскиз, проходимость и баланс ещё не утверждены."}}],"metadata":{"status":"idea","difficulty":"easy","revision":1,"source":"remaining-episodes-concepts-20260923","template":true,"requiresCampaignIntegration":true,"motif":"generator-stop"}}
