{"kind":"nubu.level","schemaVersion":2,"id":"ep3-15-easy","title":"3-15 · Вертикальный склад","episode":3,"sequence":15,"role":"develop","size":{"width":40,"height":60},"panels":[{"x":0,"y":0},{"x":1,"y":0},{"x":0,"y":1},{"x":1,"y":1},{"x":0,"y":2},{"x":1,"y":2}],"theme":"Вертикальный склад","learningGoal":"Первый большой вертикальный проект: игрок сначала видит место назначения груза, затем готовит его путь. Вход A, выход E; движение сверху вниз с одним возвратом.","designerNotes":"30.09.2026 v9. A → D → A → B → C → F → E. Проект целой комнаты: зоны описаны в документах. Редактируемая основа, полное прохождение и баланс не подтверждены. Вариации испытаний: Одно действие, два последствия: верхний пульт одновременно отпускает гирю и разворачивает нижнюю ленту. Перед нажатием нужно осмотреть, куда груз поедет после падения. | Ложный короткий путь: груз закрывает нижнюю щель, но даёт ступень к верхней галерее. Игрок использует новое положение, а не пытается вернуть исходное.","objects":[{"id":"floor-A","type":"oneWay","x":3,"y":19,"w":17,"h":1,"layer":"terrain","props":{}},{"id":"floor-B","type":"oneWay","x":23,"y":19,"w":17,"h":1,"layer":"terrain","props":{}},{"id":"floor-D","type":"oneWay","x":3,"y":39,"w":17,"h":1,"layer":"terrain","props":{}},{"id":"floor-E","type":"solid","x":0,"y":59,"w":20,"h":1,"layer":"terrain","props":{}},{"id":"floor-F","type":"solid","x":20,"y":59,"w":20,"h":1,"layer":"terrain","props":{}},{"id":"lift","type":"movingPlatform","x":11,"y":16,"w":4,"h":1,"layer":"gameplay","props":{"path":[{"x":11,"y":16},{"x":11,"y":7}],"speedCellsPerSecond":2.4,"loop":true,"enabled":true,"moving":true,"projectZone":"A"}},{"id":"run","type":"button","x":5,"y":18,"w":1,"h":1,"layer":"gameplay","props":{"buttonType":"T","sides":["up"],"targets":["lift"],"projectZone":"A"}},{"id":"grip","type":"solid","x":23,"y":10,"w":4,"h":3,"layer":"terrain","props":{"projectZone":"B"}},{"id":"release","type":"button","x":25,"y":9,"w":1,"h":1,"layer":"gameplay","props":{"buttonType":"T","sides":["up"],"targets":["shelf","lower@reverse"],"projectZone":"B"}},{"id":"cargo","type":"pushBlock","x":31,"y":25,"w":4,"h":4,"layer":"hazard","props":{"fallTrigger":"proximity","fallDelay":0.6,"projectZone":"C"}},{"id":"shelf","type":"door","x":30,"y":29,"w":6,"h":1,"layer":"gameplay","props":{"orientation":"horizontal","open":false,"projectZone":"C"}},{"id":"rest","type":"oneWay","x":8,"y":31,"w":8,"h":1,"layer":"terrain","props":{"projectZone":"D"}},{"id":"step","type":"oneWay","x":10,"y":27,"w":6,"h":1,"layer":"terrain","props":{"projectZone":"D"}},{"id":"lower","type":"conveyor","x":7,"y":56,"w":12,"h":1,"layer":"gameplay","props":{"direction":"right","speed":"slow","mode":"always","enabled":true,"projectZone":"E"}},{"id":"reverse","type":"button","x":4,"y":58,"w":1,"h":1,"layer":"gameplay","props":{"buttonType":"T","sides":["up"],"targets":["lower@reverse"],"projectZone":"E"}},{"id":"exitgate","type":"door","x":15,"y":46,"w":1,"h":6,"layer":"gameplay","props":{"orientation":"vertical","open":false,"projectZone":"E"}},{"id":"exitdock","type":"oneWay","x":12,"y":52,"w":8,"h":1,"layer":"terrain","props":{"projectZone":"E"}},{"id":"freight","type":"button","x":32,"y":58,"w":1,"h":1,"layer":"gameplay","props":{"buttonType":"T","sides":["up"],"targets":["exitgate"],"projectZone":"F"}},{"id":"receiver","type":"conveyor","x":23,"y":55,"w":10,"h":1,"layer":"gameplay","props":{"direction":"right","speed":"slow","mode":"always","enabled":true,"projectZone":"F"}},{"id":"floor-C-left","type":"oneWay","x":20,"y":39,"w":9,"h":1,"layer":"terrain","props":{}},{"id":"floor-C-right","type":"oneWay","x":36,"y":39,"w":4,"h":1,"layer":"terrain","props":{}},{"id":"return-C-0","type":"oneWay","x":20,"y":35,"w":4,"h":1,"layer":"terrain","props":{}},{"id":"return-C-1","type":"oneWay","x":23,"y":31,"w":4,"h":1,"layer":"terrain","props":{}},{"id":"return-C-2","type":"oneWay","x":20,"y":27,"w":4,"h":1,"layer":"terrain","props":{}},{"id":"return-C-3","type":"oneWay","x":23,"y":23,"w":4,"h":1,"layer":"terrain","props":{}},{"id":"return-D-0","type":"oneWay","x":0,"y":35,"w":4,"h":1,"layer":"terrain","props":{}},{"id":"return-D-1","type":"oneWay","x":3,"y":31,"w":4,"h":1,"layer":"terrain","props":{}},{"id":"return-D-2","type":"oneWay","x":0,"y":27,"w":4,"h":1,"layer":"terrain","props":{}},{"id":"return-D-3","type":"oneWay","x":3,"y":23,"w":4,"h":1,"layer":"terrain","props":{}},{"id":"return-E-0","type":"oneWay","x":0,"y":55,"w":4,"h":1,"layer":"terrain","props":{}},{"id":"return-E-1","type":"oneWay","x":3,"y":51,"w":4,"h":1,"layer":"terrain","props":{}},{"id":"return-E-2","type":"oneWay","x":0,"y":47,"w":4,"h":1,"layer":"terrain","props":{}},{"id":"return-E-3","type":"oneWay","x":3,"y":43,"w":4,"h":1,"layer":"terrain","props":{}},{"id":"return-F-1","type":"oneWay","x":23,"y":51,"w":4,"h":1,"layer":"terrain","props":{}},{"id":"return-F-2","type":"oneWay","x":20,"y":47,"w":4,"h":1,"layer":"terrain","props":{}},{"id":"return-F-3","type":"oneWay","x":23,"y":43,"w":4,"h":1,"layer":"terrain","props":{}},{"id":"spawn","type":"spawn","x":1,"y":16,"w":3,"h":3,"layer":"meta","props":{"semantics":"playerBody","anchor":"centerTop"}},{"id":"exit","type":"exit","x":16,"y":49,"w":3,"h":3,"layer":"meta","props":{"route":"main"}},{"id":"ability-WJ","type":"pickup","x":8,"y":16,"w":3,"h":3,"layer":"gameplay","props":{"pickupType":"WJ","abilityGroup":"abilities"}},{"id":"ability-GR","type":"pickup","x":16,"y":16,"w":3,"h":3,"layer":"gameplay","props":{"pickupType":"GR","abilityGroup":"abilities"}},{"id":"entry-step-0","type":"oneWay","x":4,"y":7,"w":4,"h":1,"layer":"terrain","props":{}},{"id":"entry-step-1","type":"oneWay","x":9,"y":11,"w":4,"h":1,"layer":"terrain","props":{}},{"id":"entry-step-2","type":"oneWay","x":14,"y":15,"w":4,"h":1,"layer":"terrain","props":{}}],"metadata":{"source":"level-projects-v9-20260930","status":"graybox","difficulty":"easy","revision":3,"requiresCampaignIntegration":true,"projectZones":[{"id":"A","x":0,"y":0,"plan":"Вход сверху, обзор трёх этажей через шахту; кнопка включает лифт между A и D"},{"id":"B","x":1,"y":0,"plan":"Боковой балкон: GR на монолите, окно ожидания гири и пульт её опорной двери"},{"id":"C","x":1,"y":1,"plan":"Средний правый ярус: гиря 4×4 на горизонтальной двери; открытая дверь выпускает груз в F"},{"id":"D","x":0,"y":1,"plan":"Средний левый ярус: площадка отдыха шириной 8 и лестница полок через 4 клетки к B"},{"id":"E","x":0,"y":2,"plan":"Нижняя диспетчерская: кнопка реверса нижней ленты; выход на высоте 6"},{"id":"F","x":1,"y":2,"plan":"Приёмник: гиря доезжает лентой 12 клеток до кнопки, открывающей выход в E"}],"route":"A → D → A → B → C → F → E","puzzleVariations":["Одно действие, два последствия: верхний пульт одновременно отпускает гирю и разворачивает нижнюю ленту. Перед нажатием нужно осмотреть, куда груз поедет после падения.","Ложный короткий путь: груз закрывает нижнюю щель, но даёт ступень к верхней галерее. Игрок использует новое положение, а не пытается вернуть исходное."]}}
