{"kind":"nubu.level","schemaVersion":2,"id":"ep4-02-easy","title":"4-02 · Верхний адрес","episode":4,"sequence":2,"role":"develop","size":{"width":20,"height":60},"panels":[{"x":0,"y":0},{"x":0,"y":1},{"x":0,"y":2}],"theme":"Верхний адрес","learningGoal":"Средняя вертикаль 20×60. Фактический ход C→A→выход; B — восстановление, не новый портал.","designerNotes":"30.09.2026 v9. C → A через портал; B — восстановление. Проект целой комнаты: зоны описаны в документах. Редактируемая основа, полное прохождение и баланс не подтверждены. Вариации испытаний: Высота без лестницы: нижний портал выводит на верхнюю посадку. Неправильный сход попадает на среднюю полку, откуда виден путь повторения. | Точность после переноса: верхняя бонусная полка требует отложить PDJ до выхода. Обычная посадка остаётся широкой.","objects":[{"id":"floor-A","type":"oneWay","x":3,"y":19,"w":17,"h":1,"layer":"terrain","props":{}},{"id":"floor-B","type":"oneWay","x":3,"y":39,"w":17,"h":1,"layer":"terrain","props":{}},{"id":"floor-C","type":"solid","x":0,"y":59,"w":20,"h":1,"layer":"terrain","props":{}},{"id":"landing","type":"solid","x":4,"y":12,"w":15,"h":1,"layer":"terrain","props":{"projectZone":"A"}},{"id":"mid1","type":"oneWay","x":5,"y":34,"w":6,"h":1,"layer":"terrain","props":{"projectZone":"B"}},{"id":"mid2","type":"oneWay","x":12,"y":29,"w":6,"h":1,"layer":"terrain","props":{"projectZone":"B"}},{"id":"pair-0","type":"portal","x":10,"y":53,"w":2,"h":6,"layer":"gameplay","props":{"pairId":"pair","side":"left","orientation":"vertical","length":6,"color":"blue"}},{"id":"pair-1","type":"portal","x":7,"y":5,"w":6,"h":2,"layer":"gameplay","props":{"pairId":"pair","side":"down","orientation":"horizontal","length":6,"color":"blue"}},{"id":"return-B-0","type":"oneWay","x":0,"y":35,"w":4,"h":1,"layer":"terrain","props":{}},{"id":"return-B-1","type":"oneWay","x":3,"y":31,"w":4,"h":1,"layer":"terrain","props":{}},{"id":"return-B-2","type":"oneWay","x":0,"y":27,"w":4,"h":1,"layer":"terrain","props":{}},{"id":"return-B-3","type":"oneWay","x":3,"y":23,"w":4,"h":1,"layer":"terrain","props":{}},{"id":"return-C-0","type":"oneWay","x":0,"y":55,"w":4,"h":1,"layer":"terrain","props":{}},{"id":"return-C-1","type":"oneWay","x":3,"y":51,"w":4,"h":1,"layer":"terrain","props":{}},{"id":"return-C-2","type":"oneWay","x":0,"y":47,"w":4,"h":1,"layer":"terrain","props":{}},{"id":"return-C-3","type":"oneWay","x":3,"y":43,"w":4,"h":1,"layer":"terrain","props":{}},{"id":"spawn","type":"spawn","x":1,"y":56,"w":3,"h":3,"layer":"meta","props":{"semantics":"playerBody","anchor":"centerTop"}},{"id":"exit","type":"exit","x":15,"y":9,"w":3,"h":3,"layer":"meta","props":{"route":"main"}},{"id":"ability-WJ","type":"pickup","x":4,"y":56,"w":3,"h":3,"layer":"gameplay","props":{"pickupType":"WJ","abilityGroup":"abilities"}},{"id":"ability-GR","type":"pickup","x":12,"y":56,"w":3,"h":3,"layer":"gameplay","props":{"pickupType":"GR","abilityGroup":"abilities"}},{"id":"ability-PDJ","type":"pickup","x":16,"y":56,"w":3,"h":3,"layer":"gameplay","props":{"pickupType":"PDJ","abilityGroup":"abilities"}},{"id":"entry-step-0","type":"oneWay","x":4,"y":47,"w":4,"h":1,"layer":"terrain","props":{}},{"id":"entry-step-1","type":"oneWay","x":9,"y":51,"w":4,"h":1,"layer":"terrain","props":{}},{"id":"entry-step-2","type":"oneWay","x":14,"y":55,"w":4,"h":1,"layer":"terrain","props":{}}],"metadata":{"source":"level-projects-v9-20260930","status":"graybox","difficulty":"easy","revision":3,"requiresCampaignIntegration":true,"projectZones":[{"id":"A","x":0,"y":0,"plan":"Выходной балкон и P2 направлен вниз на площадку шириной 10"},{"id":"B","x":0,"y":1,"plan":"Средний этаж: две полки для остановки и нижний путь повторения"},{"id":"C","x":0,"y":2,"plan":"Вход снизу и P1 слева от высокой стены; взгляд вверх показывает площадку A"}],"route":"C → A через портал; B — восстановление","puzzleVariations":["Высота без лестницы: нижний портал выводит на верхнюю посадку. Неправильный сход попадает на среднюю полку, откуда виден путь повторения.","Точность после переноса: верхняя бонусная полка требует отложить PDJ до выхода. Обычная посадка остаётся широкой."]}}
