{"kind":"nubu.level","schemaVersion":2,"id":"ep5-17-hard","title":"5-17 · Балкон жителей · Эскиз","episode":5,"sequence":17,"role":"intro","size":{"width":40,"height":40},"theme":"Балкон жителей","learningGoal":"Тихая комната с двумя высотами и видимым выходом; отдых после воздушных сцен.","designerNotes":"Эскиз для авторской переработки. Тихая комната с двумя высотами и видимым выходом; отдых после воздушных сцен. Вход и выход: (21,15) → (36,22). Сложность меняет ширину промежуточных опор, не таймеры. Полная проходимость не подтверждена.","objects":[{"id":"solid-001","type":"solid","x":0,"y":38,"w":20,"h":2,"layer":"terrain","props":{}},{"id":"solid-002","type":"solid","x":20,"y":38,"w":20,"h":2,"layer":"terrain","props":{}},{"id":"spawn-003","type":"spawn","x":21,"y":15,"w":3,"h":3,"layer":"meta","props":{"anchor":"centerTop","semantics":"playerBody"}},{"id":"oneWay-004","type":"oneWay","x":21,"y":18,"w":3,"h":1,"layer":"terrain","props":{}},{"id":"exit-005","type":"exit","x":36,"y":22,"w":3,"h":3,"layer":"meta","props":{"route":"main"}},{"id":"oneWay-006","type":"oneWay","x":36,"y":25,"w":3,"h":1,"layer":"terrain","props":{}},{"id":"label-007","type":"label","x":26,"y":8,"w":8,"h":2,"layer":"gameplay","props":{"mode":"message","text":"Балкон жителей","color":"#d8e2ff","decorative":true,"marquee":true}},{"id":"oneWay-008","type":"oneWay","x":5,"y":25,"w":3,"h":1,"layer":"terrain","props":{}},{"id":"oneWay-009","type":"oneWay","x":12,"y":30,"w":3,"h":1,"layer":"terrain","props":{}},{"id":"oneWay-010","type":"oneWay","x":6,"y":35,"w":3,"h":1,"layer":"terrain","props":{}},{"id":"driftField-011","type":"driftField","x":27,"y":24,"w":6,"h":13,"layer":"gameplay","props":{}},{"id":"oneWay-012","type":"oneWay","x":33,"y":26,"w":5,"h":1,"layer":"terrain","props":{}},{"id":"oneWay-013","type":"oneWay","x":22,"y":30,"w":5,"h":1,"layer":"terrain","props":{}},{"id":"door-014","type":"door","x":34,"y":22,"w":1,"h":4,"layer":"gameplay","props":{"orientation":"vertical","open":false}},{"id":"button-015","type":"button","x":23,"y":37,"w":1,"h":1,"layer":"gameplay","props":{"buttonType":"T","sides":["up"],"targets":["door-014"]}},{"id":"pickup-016","type":"pickup","x":25,"y":15,"w":3,"h":3,"layer":"gameplay","props":{"pickupType":"FL","abilityGroup":"gravity"}},{"id":"oneWay-017","type":"oneWay","x":21,"y":9,"w":3,"h":1,"layer":"terrain","props":{}},{"id":"oneWay-018","type":"oneWay","x":34,"y":13,"w":3,"h":1,"layer":"terrain","props":{}},{"id":"coin-019","type":"coin","x":25,"y":3,"w":1,"h":1,"layer":"gameplay","props":{}},{"id":"coin-020","type":"coin","x":33,"y":8,"w":1,"h":1,"layer":"gameplay","props":{}},{"id":"coin-021","type":"coin","x":29,"y":15,"w":1,"h":1,"layer":"gameplay","props":{}},{"id":"oneWay-022","type":"oneWay","x":1,"y":29,"w":3,"h":1,"layer":"terrain","props":{}},{"id":"oneWay-023","type":"oneWay","x":14,"y":33,"w":3,"h":1,"layer":"terrain","props":{}},{"id":"oneWay-024","type":"oneWay","x":7,"y":37,"w":3,"h":1,"layer":"terrain","props":{}},{"id":"coin-025","type":"coin","x":5,"y":23,"w":1,"h":1,"layer":"gameplay","props":{}},{"id":"coin-026","type":"coin","x":13,"y":28,"w":1,"h":1,"layer":"gameplay","props":{}},{"id":"coin-027","type":"coin","x":9,"y":35,"w":1,"h":1,"layer":"gameplay","props":{}},{"id":"oneWay-028","type":"oneWay","x":21,"y":29,"w":3,"h":1,"layer":"terrain","props":{}},{"id":"oneWay-029","type":"oneWay","x":34,"y":33,"w":3,"h":1,"layer":"terrain","props":{}},{"id":"oneWay-030","type":"oneWay","x":27,"y":37,"w":3,"h":1,"layer":"terrain","props":{}},{"id":"coin-031","type":"coin","x":25,"y":23,"w":1,"h":1,"layer":"gameplay","props":{}},{"id":"coin-032","type":"coin","x":33,"y":28,"w":1,"h":1,"layer":"gameplay","props":{}},{"id":"coin-033","type":"coin","x":29,"y":35,"w":1,"h":1,"layer":"gameplay","props":{}},{"id":"developerNote-034","type":"developerNote","x":20,"y":15,"w":1,"h":1,"layer":"meta","props":{"comment":"Тихая комната с двумя высотами и видимым выходом; отдых после воздушных сцен. Эскиз, проходимость и баланс ещё не утверждены."}}],"metadata":{"status":"idea","revision":1,"source":"remaining-episodes-concepts-20260923","difficulty":"hard","template":true,"requiresCampaignIntegration":true,"motif":"rest"},"panels":[{"x":1,"y":0},{"x":0,"y":1},{"x":1,"y":1}]}
