{"kind":"nubu.level","schemaVersion":2,"id":"ep4-06-hard","title":"4-6 · Выбор направления · Эскиз","episode":4,"sequence":6,"role":"develop","size":{"width":60,"height":40},"theme":"Выбор направления","learningGoal":"Остановись в ручной пушке и выбери момент выхода.","designerNotes":"Эскиз для авторской переработки. Остановись в ручной пушке и выбери момент выхода. Вход и выход: (56,22) → (21,35). Сложность меняет ширину промежуточных опор, не таймеры. Полная проходимость не подтверждена.","objects":[{"id":"solid-001","type":"solid","x":0,"y":38,"w":20,"h":2,"layer":"terrain","props":{}},{"id":"solid-002","type":"solid","x":20,"y":38,"w":20,"h":2,"layer":"terrain","props":{}},{"id":"solid-003","type":"solid","x":40,"y":38,"w":20,"h":2,"layer":"terrain","props":{}},{"id":"spawn-004","type":"spawn","x":56,"y":22,"w":3,"h":3,"layer":"meta","props":{"anchor":"centerTop","semantics":"playerBody"}},{"id":"oneWay-005","type":"oneWay","x":56,"y":25,"w":3,"h":1,"layer":"terrain","props":{}},{"id":"exit-006","type":"exit","x":21,"y":35,"w":3,"h":3,"layer":"meta","props":{"route":"main"}},{"id":"playerCannon-007","type":"playerCannon","x":5,"y":12,"w":2,"h":2,"layer":"gameplay","props":{"dirs":["upRight","right","downRight","down","downLeft","left","upLeft","up"],"direction":"upRight","manual":true,"rotateInterval":0.5,"clockwise":true}},{"id":"oneWay-008","type":"oneWay","x":12,"y":5,"w":5,"h":1,"layer":"terrain","props":{}},{"id":"portal-009","type":"portal","x":4,"y":28,"w":2,"h":6,"layer":"gameplay","props":{"pairId":"P4-6-0-1","color":"purple","orientation":"vertical","side":"right","length":6}},{"id":"portal-010","type":"portal","x":14,"y":24,"w":2,"h":6,"layer":"gameplay","props":{"pairId":"P4-6-0-1","color":"purple","orientation":"vertical","side":"left","length":6}},{"id":"cannon-011","type":"cannon","x":26,"y":27,"w":2,"h":2,"layer":"gameplay","props":{"direction":"right","interval":2,"enabled":true,"projectileMode":"soft"}},{"id":"button-012","type":"button","x":36,"y":37,"w":1,"h":1,"layer":"gameplay","props":{"buttonType":"T","sides":["up"],"targets":["cannon-011"]}},{"id":"solid-013","type":"solid","x":32,"y":31,"w":2,"h":4,"layer":"terrain","props":{}},{"id":"playerCannon-014","type":"playerCannon","x":45,"y":32,"w":2,"h":2,"layer":"gameplay","props":{"dirs":["upRight","right","downRight","down","downLeft","left","upLeft","up"],"direction":"upRight","manual":true,"rotateInterval":0.5,"clockwise":false}},{"id":"oneWay-015","type":"oneWay","x":1,"y":9,"w":3,"h":1,"layer":"terrain","props":{}},{"id":"oneWay-016","type":"oneWay","x":14,"y":13,"w":3,"h":1,"layer":"terrain","props":{}},{"id":"oneWay-017","type":"oneWay","x":7,"y":17,"w":3,"h":1,"layer":"terrain","props":{}},{"id":"coin-018","type":"coin","x":5,"y":3,"w":1,"h":1,"layer":"gameplay","props":{}},{"id":"coin-019","type":"coin","x":13,"y":8,"w":1,"h":1,"layer":"gameplay","props":{}},{"id":"coin-020","type":"coin","x":9,"y":15,"w":1,"h":1,"layer":"gameplay","props":{}},{"id":"oneWay-021","type":"oneWay","x":1,"y":29,"w":3,"h":1,"layer":"terrain","props":{}},{"id":"oneWay-022","type":"oneWay","x":14,"y":33,"w":3,"h":1,"layer":"terrain","props":{}},{"id":"oneWay-023","type":"oneWay","x":7,"y":37,"w":3,"h":1,"layer":"terrain","props":{}},{"id":"coin-024","type":"coin","x":5,"y":23,"w":1,"h":1,"layer":"gameplay","props":{}},{"id":"coin-025","type":"coin","x":13,"y":28,"w":1,"h":1,"layer":"gameplay","props":{}},{"id":"coin-026","type":"coin","x":9,"y":35,"w":1,"h":1,"layer":"gameplay","props":{}},{"id":"oneWay-027","type":"oneWay","x":21,"y":29,"w":3,"h":1,"layer":"terrain","props":{}},{"id":"oneWay-028","type":"oneWay","x":34,"y":33,"w":3,"h":1,"layer":"terrain","props":{}},{"id":"oneWay-029","type":"oneWay","x":27,"y":37,"w":3,"h":1,"layer":"terrain","props":{}},{"id":"coin-030","type":"coin","x":25,"y":23,"w":1,"h":1,"layer":"gameplay","props":{}},{"id":"coin-031","type":"coin","x":33,"y":28,"w":1,"h":1,"layer":"gameplay","props":{}},{"id":"coin-032","type":"coin","x":29,"y":35,"w":1,"h":1,"layer":"gameplay","props":{}},{"id":"oneWay-033","type":"oneWay","x":41,"y":29,"w":3,"h":1,"layer":"terrain","props":{}},{"id":"oneWay-034","type":"oneWay","x":54,"y":33,"w":3,"h":1,"layer":"terrain","props":{}},{"id":"oneWay-035","type":"oneWay","x":47,"y":37,"w":3,"h":1,"layer":"terrain","props":{}},{"id":"coin-036","type":"coin","x":45,"y":23,"w":1,"h":1,"layer":"gameplay","props":{}},{"id":"coin-037","type":"coin","x":53,"y":28,"w":1,"h":1,"layer":"gameplay","props":{}},{"id":"coin-038","type":"coin","x":49,"y":35,"w":1,"h":1,"layer":"gameplay","props":{}},{"id":"developerNote-039","type":"developerNote","x":55,"y":22,"w":1,"h":1,"layer":"meta","props":{"comment":"Остановись в ручной пушке и выбери момент выхода. Эскиз, проходимость и баланс ещё не утверждены."}}],"metadata":{"status":"idea","revision":1,"source":"remaining-episodes-concepts-20260923","difficulty":"hard","template":true,"requiresCampaignIntegration":true,"motif":"cannon-manual"},"panels":[{"x":0,"y":0},{"x":0,"y":1},{"x":1,"y":1},{"x":2,"y":1}]}
